{
  "$schema": "https://json-schema.org/draft/2020-12/schema",
  "$id": "urn:research-loom:core:capability-context-pack:0.1.0",
  "title": "research-loom bounded Capability Context Pack",
  "description": "Bounded, content-pinned research context supplied to a capability. Governance material is carried structurally and may not be silently dropped because of a context budget.",
  "type": "object",
  "additionalProperties": false,
  "required": [
    "schema_version",
    "context_pack_id",
    "project_id",
    "purpose",
    "pins",
    "question_ids",
    "research_object_references",
    "resources",
    "research_attention",
    "project_constraints",
    "effective_constraints",
    "bounds",
    "context_pack_digest"
  ],
  "properties": {
    "schema_version": {
      "const": "0.1.0"
    },
    "context_pack_id": {
      "$ref": "#/$defs/identifier"
    },
    "project_id": {
      "$ref": "#/$defs/identifier"
    },
    "purpose": {
      "type": "string",
      "minLength": 1
    },
    "pins": {
      "$ref": "#/$defs/pins"
    },
    "question_ids": {
      "type": "array",
      "minItems": 1,
      "uniqueItems": true,
      "items": {
        "$ref": "#/$defs/identifier"
      }
    },
    "research_object_references": {
      "type": "array",
      "items": {
        "$ref": "#/$defs/research_object_reference"
      }
    },
    "resources": {
      "type": "array",
      "items": {
        "$ref": "#/$defs/resource"
      }
    },
    "research_attention": {
      "type": "array",
      "items": {
        "$ref": "#/$defs/attention_item"
      }
    },
    "project_constraints": {
      "$ref": "#/$defs/project_constraints"
    },
    "effective_constraints": {
      "type": "array",
      "items": {
        "$ref": "#/$defs/effective_constraint"
      }
    },
    "bounds": {
      "$ref": "#/$defs/bounds"
    },
    "context_pack_digest": {
      "$ref": "#/$defs/digest"
    }
  },
  "$defs": {
    "identifier": {
      "type": "string",
      "pattern": "^[A-Za-z0-9][A-Za-z0-9._-]{0,127}$"
    },
    "capability_id": {
      "type": "string",
      "pattern": "^[a-z0-9][a-z0-9._-]{0,127}$"
    },
    "function_id": {
      "type": "string",
      "pattern": "^[a-z0-9][a-z0-9._-]{0,127}$"
    },
    "semver": {
      "type": "string",
      "pattern": "^(0|[1-9][0-9]*)\\.(0|[1-9][0-9]*)\\.(0|[1-9][0-9]*)$"
    },
    "digest": {
      "type": "string",
      "pattern": "^sha256:[0-9a-f]{64}$"
    },
    "execution_mode": {
      "enum": [
        "real",
        "virtual",
        "synthetic_test"
      ]
    },
    "profile_pin": {
      "type": "object",
      "additionalProperties": false,
      "required": [
        "profile_id",
        "profile_type",
        "profile_version",
        "manifest_sha256"
      ],
      "properties": {
        "profile_id": {
          "type": "string",
          "pattern": "^[a-z0-9][a-z0-9._-]{0,127}$"
        },
        "profile_type": {
          "enum": [
            "research",
            "organization",
            "narrative",
            "publication"
          ]
        },
        "profile_version": {
          "$ref": "#/$defs/semver"
        },
        "manifest_sha256": {
          "type": "string",
          "pattern": "^[0-9a-f]{64}$"
        }
      }
    },
    "research_snapshot_pin": {
      "type": "object",
      "additionalProperties": false,
      "required": [
        "snapshot_id",
        "revision",
        "content_digest"
      ],
      "properties": {
        "snapshot_id": {
          "$ref": "#/$defs/identifier"
        },
        "revision": {
          "type": "integer",
          "minimum": 0
        },
        "content_digest": {
          "$ref": "#/$defs/digest"
        }
      }
    },
    "pins": {
      "type": "object",
      "additionalProperties": false,
      "required": [
        "project_config",
        "effective_profile_set",
        "research_snapshot"
      ],
      "properties": {
        "project_config": {
          "type": "object",
          "additionalProperties": false,
          "required": [
            "configuration_digest"
          ],
          "properties": {
            "configuration_digest": {
              "$ref": "#/$defs/digest"
            }
          }
        },
        "effective_profile_set": {
          "type": "object",
          "additionalProperties": false,
          "required": [
            "schema_version",
            "content_digest",
            "core_contracts",
            "profile_pins"
          ],
          "properties": {
            "schema_version": {
              "const": "0.1.0"
            },
            "core_contracts": {
              "type": "object",
              "additionalProperties": false,
              "required": [
                "research_contract",
                "invariant_contract"
              ],
              "properties": {
                "research_contract": {
                  "$ref": "#/$defs/semver"
                },
                "invariant_contract": {
                  "$ref": "#/$defs/semver"
                }
              }
            },
            "profile_pins": {
              "type": "array",
              "minItems": 1,
              "items": {
                "$ref": "#/$defs/profile_pin"
              }
            },
            "content_digest": {
              "$ref": "#/$defs/digest"
            }
          }
        },
        "research_snapshot": {
          "$ref": "#/$defs/research_snapshot_pin"
        }
      }
    },
    "research_object_reference": {
      "type": "object",
      "additionalProperties": false,
      "required": [
        "kind",
        "id",
        "revision"
      ],
      "properties": {
        "kind": {
          "enum": [
            "research_question",
            "claim",
            "method",
            "source",
            "evidence",
            "analysis",
            "finding",
            "counter_review",
            "argument",
            "contribution",
            "recommendation",
            "next_action",
            "decision",
            "artifact",
            "snapshot",
            "project",
            "audit_event"
          ]
        },
        "id": {
          "$ref": "#/$defs/identifier"
        },
        "revision": {
          "type": "integer",
          "minimum": 0
        }
      }
    },
    "resource": {
      "type": "object",
      "additionalProperties": false,
      "required": [
        "reference_id",
        "reference_type",
        "access_mode",
        "evidentiary_use"
      ],
      "properties": {
        "reference_id": {
          "$ref": "#/$defs/identifier"
        },
        "reference_type": {
          "enum": [
            "input",
            "source",
            "artifact"
          ]
        },
        "object_id": {
          "$ref": "#/$defs/identifier"
        },
        "locator": {
          "type": "string",
          "minLength": 1
        },
        "digest": {
          "$ref": "#/$defs/digest"
        },
        "access_mode": {
          "const": "read"
        },
        "evidentiary_use": {
          "enum": [
            "candidate_source",
            "context_only"
          ]
        }
      },
      "anyOf": [
        {
          "required": [
            "object_id"
          ]
        },
        {
          "required": [
            "locator"
          ]
        }
      ],
      "allOf": [
        {
          "if": {
            "properties": {
              "reference_type": {
                "enum": [
                  "input",
                  "artifact"
                ]
              }
            },
            "required": [
              "reference_type"
            ]
          },
          "then": {
            "properties": {
              "evidentiary_use": {
                "const": "context_only"
              }
            }
          }
        }
      ]
    },
    "projection_hint": {
      "type": "object",
      "additionalProperties": false,
      "required": [
        "hint_type",
        "value",
        "normative"
      ],
      "properties": {
        "hint_type": {
          "enum": [
            "provisional_outline",
            "publication_location",
            "primary_exposition_location",
            "literal_heading",
            "chapter_number"
          ]
        },
        "value": {
          "type": "string",
          "minLength": 1
        },
        "normative": {
          "const": false
        }
      }
    },
    "attention_item": {
      "type": "object",
      "additionalProperties": false,
      "required": [
        "attention_id",
        "statement",
        "disposition"
      ],
      "properties": {
        "attention_id": {
          "$ref": "#/$defs/identifier"
        },
        "statement": {
          "type": "string",
          "minLength": 1
        },
        "rationale": {
          "type": "string"
        },
        "source_reference_ids": {
          "type": "array",
          "uniqueItems": true,
          "items": {
            "$ref": "#/$defs/identifier"
          }
        },
        "related_question_ids": {
          "type": "array",
          "uniqueItems": true,
          "items": {
            "$ref": "#/$defs/identifier"
          }
        },
        "related_question_seed_ids": {
          "type": "array",
          "uniqueItems": true,
          "items": {
            "$ref": "#/$defs/identifier"
          }
        },
        "disposition": {
          "enum": [
            "active",
            "dropped",
            "out_of_scope"
          ]
        },
        "disposition_reason": {
          "type": "string",
          "minLength": 1
        },
        "projection_hints": {
          "type": "array",
          "items": {
            "$ref": "#/$defs/projection_hint"
          }
        }
      }
    },
    "guard": {
      "type": "object",
      "additionalProperties": false,
      "required": [
        "guard_id",
        "statement"
      ],
      "properties": {
        "guard_id": {
          "$ref": "#/$defs/identifier"
        },
        "statement": {
          "type": "string",
          "minLength": 1
        },
        "rationale": {
          "type": "string"
        }
      }
    },
    "project_constraints": {
      "type": "object",
      "additionalProperties": false,
      "required": [
        "requirements",
        "prohibitions",
        "must_not_claim"
      ],
      "properties": {
        "requirements": {
          "type": "array",
          "items": {
            "$ref": "#/$defs/guard"
          }
        },
        "prohibitions": {
          "type": "array",
          "items": {
            "$ref": "#/$defs/guard"
          }
        },
        "must_not_claim": {
          "type": "array",
          "items": {
            "$ref": "#/$defs/guard"
          }
        }
      }
    },
    "constraint_source": {
      "type": "object",
      "additionalProperties": false,
      "required": [
        "profile_id",
        "profile_type",
        "profile_version",
        "manifest_sha256",
        "constraint_id"
      ],
      "properties": {
        "profile_id": {
          "type": "string",
          "pattern": "^[a-z0-9][a-z0-9._-]{0,127}$"
        },
        "profile_type": {
          "enum": [
            "research",
            "organization",
            "narrative",
            "publication"
          ]
        },
        "profile_version": {
          "$ref": "#/$defs/semver"
        },
        "manifest_sha256": {
          "type": "string",
          "pattern": "^[0-9a-f]{64}$"
        },
        "constraint_id": {
          "type": "string",
          "minLength": 1
        }
      }
    },
    "effective_constraint": {
      "type": "object",
      "additionalProperties": false,
      "required": [
        "path",
        "merge_strategy",
        "value",
        "resolution",
        "provenance"
      ],
      "properties": {
        "path": {
          "type": "string",
          "pattern": "^(?!core\\.)(?:[a-z][a-z0-9_]*)(?:\\.[a-z][a-z0-9_]*)+$"
        },
        "merge_strategy": {
          "enum": [
            "must_equal",
            "union",
            "intersection",
            "max",
            "min",
            "replace"
          ]
        },
        "value": {},
        "resolution": {
          "enum": [
            "single",
            "identical",
            "union",
            "intersection",
            "max",
            "min",
            "descendant_replace"
          ]
        },
        "provenance": {
          "type": "array",
          "minItems": 1,
          "items": {
            "$ref": "#/$defs/constraint_source"
          }
        }
      }
    },
    "bounds": {
      "type": "object",
      "additionalProperties": false,
      "required": [
        "max_questions",
        "max_research_object_references",
        "max_resources",
        "max_attention_items",
        "max_project_guards",
        "max_effective_constraints"
      ],
      "properties": {
        "max_questions": {
          "type": "integer",
          "minimum": 0
        },
        "max_research_object_references": {
          "type": "integer",
          "minimum": 0
        },
        "max_resources": {
          "type": "integer",
          "minimum": 0
        },
        "max_attention_items": {
          "type": "integer",
          "minimum": 0
        },
        "max_project_guards": {
          "type": "integer",
          "minimum": 0
        },
        "max_effective_constraints": {
          "type": "integer",
          "minimum": 0
        }
      }
    }
  }
}
