{"schema_version":"0.1.0","context_pack_id":"CTX-RM-001","project_id":"PRJ-1","purpose":"Exercise Research Method contracts with an exact prior PR9 Handoff Evidence Gap reference.","pins":{"project_config":{"configuration_digest":"sha256:9fa677cbca9f50f54055021d8c1f0febfe636795a96931174f2aef6052fb13fb"},"effective_profile_set":{"schema_version":"0.1.0","core_contracts":{"research_contract":"0.1.0","invariant_contract":"0.1.0"},"profile_pins":[{"profile_id":"fixture.research-base","profile_type":"research","profile_version":"1.0.0","manifest_sha256":"6311662384e51505f779c16212fc1cd892dafeb0260c680e8a51490f0c263f34"},{"profile_id":"fixture.research-strict","profile_type":"research","profile_version":"1.1.0","manifest_sha256":"d2a5a454e139b17f5bf574098acbb663306c85169adbf5e6a98027d837205f66"},{"profile_id":"fixture.organization","profile_type":"organization","profile_version":"2.0.0","manifest_sha256":"888a427c2bc15acfa775af145dccc2eeeb1941d53cdb5144901a69d75d5014b5"},{"profile_id":"fixture.narrative","profile_type":"narrative","profile_version":"1.0.0","manifest_sha256":"c85bb1e8127d9145ccaf0d97df4c6a0bcbad37afeb2cd43c886889be9a7e3570"},{"profile_id":"fixture.publication","profile_type":"publication","profile_version":"1.0.0","manifest_sha256":"c47fad44c58ba2f1b53c6ee6a26724dd42e0190e58c9ab619dbdb625c1ff945e"}],"content_digest":"sha256:a1baf6267ba5a6e043a31760d303f625691f699af45f31a70586641ba24bd693"},"research_snapshot":{"snapshot_id":"SNP-1","revision":0,"content_digest":"sha256:eb0b25b360df904b109f94bf5cdb3d4a7e3d59fca40fc48a1f95ffca26657391"}},"question_ids":["RQ-1"],"research_object_references":[{"kind":"research_question","id":"RQ-1","revision":0},{"kind":"snapshot","id":"SNP-1","revision":0}],"resources":[{"reference_id":"REF-HANDOFF-001","reference_type":"artifact","locator":"handoffs/HND-001.json","digest":"sha256:bdd5842f6369f85aa8effa10c42562ff905f1ec0b57907fc14d38ec6ff836b21","access_mode":"read","evidentiary_use":"context_only"}],"research_attention":[],"project_constraints":{"requirements":[],"prohibitions":[],"must_not_claim":[]},"effective_constraints":[],"bounds":{"max_questions":1,"max_research_object_references":2,"max_resources":1,"max_attention_items":0,"max_project_guards":0,"max_effective_constraints":0},"context_pack_digest":"sha256:874657100280b3bbe1d9cf5224ba5ac86d0d71c55b8a9af8353cb0712648839d"}