{"schema_version":"0.1.0","context_pack_id":"CTX-001","project_id":"PRJ-1","purpose":"Exercise capability invocation and handoff boundaries with a bounded synthetic context.","pins":{"project_config":{"configuration_digest":"sha256:9fa677cbca9f50f54055021d8c1f0febfe636795a96931174f2aef6052fb13fb"},"effective_profile_set":{"schema_version":"0.1.0","core_contracts":{"research_contract":"0.1.0","invariant_contract":"0.1.0"},"profile_pins":[{"profile_id":"fixture.research-base","profile_type":"research","profile_version":"1.0.0","manifest_sha256":"6311662384e51505f779c16212fc1cd892dafeb0260c680e8a51490f0c263f34"},{"profile_id":"fixture.research-strict","profile_type":"research","profile_version":"1.1.0","manifest_sha256":"1d7bbbe2d43ac8e54da1cb1cb940dcf0be977543d97a8fb218a453969e50069d"},{"profile_id":"fixture.organization","profile_type":"organization","profile_version":"2.0.0","manifest_sha256":"888a427c2bc15acfa775af145dccc2eeeb1941d53cdb5144901a69d75d5014b5"},{"profile_id":"fixture.narrative","profile_type":"narrative","profile_version":"1.0.0","manifest_sha256":"c85bb1e8127d9145ccaf0d97df4c6a0bcbad37afeb2cd43c886889be9a7e3570"},{"profile_id":"fixture.publication","profile_type":"publication","profile_version":"1.0.0","manifest_sha256":"c47fad44c58ba2f1b53c6ee6a26724dd42e0190e58c9ab619dbdb625c1ff945e"}],"content_digest":"sha256:ab4631d96e1d81f6f8cb3fda8d62dc5fbf5c7500895001cb91f16f803d336e17"},"research_snapshot":{"snapshot_id":"SNP-1","revision":0,"content_digest":"sha256:eb0b25b360df904b109f94bf5cdb3d4a7e3d59fca40fc48a1f95ffca26657391"}},"question_ids":["RQ-1"],"research_object_references":[{"kind":"research_question","id":"RQ-1","revision":0},{"kind":"finding","id":"FND-1","revision":0},{"kind":"snapshot","id":"SNP-1","revision":0}],"resources":[{"reference_id":"REF-INPUT-001","reference_type":"input","locator":"inputs/synthetic-brief.md","digest":"sha256:1111111111111111111111111111111111111111111111111111111111111111","access_mode":"read","evidentiary_use":"context_only"},{"reference_id":"REF-SOURCE-001","reference_type":"source","object_id":"SRC-1","access_mode":"read","evidentiary_use":"candidate_source"},{"reference_id":"REF-ARTIFACT-001","reference_type":"artifact","object_id":"ART-1","locator":"artifacts/synthetic-context.json","access_mode":"read","evidentiary_use":"context_only"}],"research_attention":[{"attention_id":"ATT-FIXTURE-001","statement":"Preserve the distinction between observed findings and proposed explanations.","rationale":"The issue should remain visible while question candidates and coverage evolve.","source_reference_ids":["REF-INPUT-001"],"related_question_ids":["RQ-1"],"related_question_seed_ids":["RQ-SEED-001"],"disposition":"active","projection_hints":[{"hint_type":"publication_location","value":"provisional explanatory location","normative":false}]},{"attention_id":"ATT-FIXTURE-002","statement":"A separate synthetic topic is intentionally excluded from this project.","disposition":"out_of_scope","disposition_reason":"It does not contribute to the synthetic fixture objective."}],"project_constraints":{"requirements":[{"guard_id":"GUARD-REQ-001","statement":"Keep unresolved project uncertainties visible in project-facing outputs."}],"prohibitions":[{"guard_id":"GUARD-PRO-001","statement":"Do not treat a configured resource reference as Evidence merely because it is listed."}],"must_not_claim":[{"guard_id":"GUARD-CLAIM-001","statement":"Do not claim a real-world causal effect from this synthetic fixture."}]},"effective_constraints":[{"path":"evidence.capture.locator_precision","merge_strategy":"must_equal","value":"exact","resolution":"single","provenance":[{"profile_id":"fixture.research-strict","profile_type":"research","profile_version":"1.1.0","manifest_sha256":"1d7bbbe2d43ac8e54da1cb1cb940dcf0be977543d97a8fb218a453969e50069d","constraint_id":"FIX-RES-003"}]},{"path":"evidence.capture.required_fields","merge_strategy":"union","value":["captured_hash","locator","source_id"],"resolution":"union","provenance":[{"profile_id":"fixture.research-base","profile_type":"research","profile_version":"1.0.0","manifest_sha256":"6311662384e51505f779c16212fc1cd892dafeb0260c680e8a51490f0c263f34","constraint_id":"FIX-RES-001"},{"profile_id":"fixture.research-strict","profile_type":"research","profile_version":"1.1.0","manifest_sha256":"1d7bbbe2d43ac8e54da1cb1cb940dcf0be977543d97a8fb218a453969e50069d","constraint_id":"FIX-RES-002"}]},{"path":"narrative.semantic_stages","merge_strategy":"must_equal","value":["framing","synthesis"],"resolution":"single","provenance":[{"profile_id":"fixture.narrative","profile_type":"narrative","profile_version":"1.0.0","manifest_sha256":"c85bb1e8127d9145ccaf0d97df4c6a0bcbad37afeb2cd43c886889be9a7e3570","constraint_id":"FIX-NAR-001"}]},{"path":"organization.review.roles","merge_strategy":"union","value":["human-reviewer"],"resolution":"single","provenance":[{"profile_id":"fixture.organization","profile_type":"organization","profile_version":"2.0.0","manifest_sha256":"888a427c2bc15acfa775af145dccc2eeeb1941d53cdb5144901a69d75d5014b5","constraint_id":"FIX-ORG-001"}]},{"path":"publication.outputs.formats","merge_strategy":"union","value":["fixture-format"],"resolution":"single","provenance":[{"profile_id":"fixture.publication","profile_type":"publication","profile_version":"1.0.0","manifest_sha256":"c47fad44c58ba2f1b53c6ee6a26724dd42e0190e58c9ab619dbdb625c1ff945e","constraint_id":"FIX-PUB-001"}]}],"bounds":{"max_questions":1,"max_research_object_references":3,"max_resources":3,"max_attention_items":2,"max_project_guards":3,"max_effective_constraints":5},"context_pack_digest":"sha256:d6a91b9a6127f2ad396255ffdf95ea2d79a79a0339421c0936e36f7cba197bd8"}
